Family,Unit #,Region,Route #,Route Name,Flyer Ct.,Route Description
,,EAST TAUNTON,5-7,OLD COLONY AVE.,120,MIDDLEBORO AVE. (from LIBERTY ST. to SHERWOOD AVE.) - All // SHERWOOD AVE. - All // S.PRECINCT ST. (from CASWELL ST. to MIDDLEBORO AVE.) - All 
,,EAST TAUNTON,5-8,DOLAN CIR.,115,DOLAN CIR. - All // MARGARET RD. - All // VIKING ST. - All // SEAVER ST. - All // COYLE ST. - All // N. PRECINCT ST. - All 
,,EAST TAUNTON,5-9,MIDDLEBORO AVE. #6,130,MIDDLEBORO AVE. (from SHERWOOD AVE. to BIRCHWOOD DR.) - All // GATSBY DR. - All // PARK PL. - All // BIRCHWOOD DR. - All // RICHMOND ST. - All // RIVER ST. - All 
,,EAST TAUNTON,5-10,CASWELL ST. #1,150,CASWELL ST. (from FAIRBANKS AVE. to LIBERTY ST.) - All // PAT REE DR. - All // LIBERTY ST. - All // BROOKSIDE AVE. - All // O’CONNOR ST. - All // ROUTES BEGIN AND END. ALL MEANS
,,EAST TAUNTON,5-11,GRACE MEADOW DR.,100,GRACE MEADOW DR - All // ERIN RD. - All // TANIA DR. - All 
,,EAST TAUNTON,5-12,MOCKINGBIRD WAY,190,MOCKINGBIRD WAY - All // CORMORANT ST. - All // BLACKBIRD LANE - All // PUFFIN WAY - All // WREN ST. - All // HUMMINGBIRD LANE - All // BLUEJAY LN. - All // KINGFISHER WAY - All // CARDINAL CIR. - All // SANDPIPER DR. - All // DOVE DR. - All // SWAN DR. - All // ROUTES BEGIN AND END. ALL MEANS BOTH SIDES OF STREET. THIS IS TO AVOID
,,EAST TAUNTON,5-13,POWHATTEN ESTATES,195,SAKONET AVE. - All // POWHATTEN DR. - All // TYASHK ST. - All // METACOMET AVE. - All // POCASSET PL. - All // MEESHAWN AVE. - All // WAMPUM RD. - All // BEAR PAW TRAIL - All // BUFFALO WAY - All // CHESHIRE DR. - All // CAMBRIDGE ST. - All // WINDSOR CT.  - All 
,,EAST TAUNTON,5-14,CASWELL ST. #2,235,CASWELL ST. (from LIBERTY to STAPLES ST.) - All // STAPLES ST. – All // FIDDLERS WAY - All // COTUIT DR. - All 
,,EAST TAUNTON,5-15,SEEKEL ST.,150,SEEKEL ST. - All // HUTT FOREST - All // NINA WAY - All // KINGMAN ST. (from SEEKEL to S. PRECINCT STS.) - All // S. PRECINCT ST. (from KINGMAN to MYRICKS STS.) - All // WOODLAND TRAIL - All 
,,EAST TAUNTON,5-16,CASWELL ST. #3,85,CASWELL ST. (from STAPLES to S. PRECINCT STS.) - All // BETSY RD. - All // SAGAMORE RD. - All // KINGS POND RD. - All // S. PRECINCT ST. (from CASWELL to KINGMAN STS.) - All 
,,EAST TAUNTON,5-17,MYRICKS ST. #1,90,MYRICKS ST. (from ROUTE 140 to KINGMAN ST.) - All // CLAIRE TERR. - All // BIRCH AVE. - All // JOSHUA LN. - All // KINGMAN ST. (from MYRICKS to SEEKEL STS.) - All 
,,EAST TAUNTON,5-18,MYRICKS ST. #2,60,MYRICKS ST. (from KINGMAN to S. PRECINCT STS.) - All // MATTHEWS DR. - All // MEAGHAN CIR. - All // GRACE CIR. - All // RHODE ISLAND RD. - All 
,,EAST TAUNTON,5-19,TURNER ST.,150,TURNER ST. - All // HIGHSTONE ST. - All // WILDERNESS WAY - All // DAVIDS WAY - All // CAINE HILL DR. - All // STRAWBERRY LANE - All // KERRY LN. - All 
,,EAST TAUNTON,5-20,COUNTY ST.,125,COUNTY ST. (from SILVER CITY GALLERIA to BERKLEY LINE) - All // BETTISON CT. - All // HOLLOWAY ST. (LEFT NEAR PACKAGE STORE) - All // HYACINTH ST. - All // DAFFODIL LANE - All // COTLEY RD.\- All 
,,EAST TAUNTON,5-21,DRIFTWOOD ESTATES,75,TYNAN ST. - All // MORRISON RD. - All // ROWLEY AVE- All // 
,,WESTVILLE,6-1,COHANNET ST. #1,165,COHANNET ST. (from PORTER to WINTHROP STS.) - All // PORTER ST. - All // MASON ST. - All // MYRTLE ST. - All // MYRTLE PL. - All // WINTHROP ST. (from RR TRACKS to PORTER ST.) - ODD #s
,,WESTVILLE,6-2,COHANNET ST. #2,110,COHANNET ST. (from WINTHROP ST. to CEMETARY) - All // BARNUM ST. (from COHANNET to CLINTON STS.) - All // MIDLAND RD. - All // CROCKER ST. - All // CLINTON ST. (from BARNUM to WALNUT STS.) - All // WALNUT ST. - All 
,,WESTVILLE,6-3,COHANNET ST. #3,200,COHANNET ST. (from BARNUM to SILVER STS.) - EVEN #s // W. WEIR ST. - All // W. WEIR ST. (EXTENSION) - All // EVERETT ST. - All // GEN. COBB ST. - All // COUCH ST. - All // DALE ST. - All // SILVER ST. (from COUCH to COHANNET STS.) - All // DWINELL ST. - All 
,,WESTVILLE,6-4,COHANNET ST. #4,150,COHANNET ST. (from BARNUM ST. to LUSCOMB RD.) - ODD #s // BROOK ST. - All // SILVER ST. (from COHANNET to WINTHROP STS.) - All // EARL ST. - All // LUSCOMB RD. - All // WINTHROP ST. (from LUSCOMB RD. to COHANNET ST.) - EVEN #s // WILMARTH ST. - All 
,,WESTVILLE,6-5,COHANNET ST. #5,90,COHANNET ST. (from Silver St. to Warner Blvd.) – EVEN #s // HAMLEN ST. - All // APPLEBLOSSOM LN. - All // RED CIR. – All // DIGHTON RD. - ALL
,,WESTVILLE,6-6,COHANNET ST. #6,160,COHANNET ST. (from LUSCOMB RD. to WARNER BLVD.) - ODD #s // WARNER BLVD. - All // ARABIAN DR. – All // MUSTANG DR. – All // APPALOOSA WAY – All // SHETLAND RD. – All // COLT CIR. - All // COHANNET ST. (from WARNER BLVD. to END) - All // AVALON DR. – All // NUTHATCH LN. – All // WESTVILLE TERRACE - All 
,,WESTVILLE,6-7,WINTHROP ST. #1,80,WINTHROP ST. (from PORTER to ANDERSON STS.) - ODD #s // WINTHROP ST. (from LUSCOMB RD. to WARNER BLVD.) - EVEN #s // WINTHROP AVE. - All // WINTHROP PL. - All // CLARENCE AVE. - All 
,,WESTVILLE,6-8,WINTHROP ST. #2,150,WINTHROP ST. (from ANDERSON ST. to FAIRVIEW AVE.) - ODD #s // ANDERSON ST. - All // WHITEHILL ST. - All // FAIRVIEW AVE. - All // ALPINE AVE. - All // LAUREL ST. - All // FLORENCE ST. - All // CROSSMAN ST. - All // KALMAN ST. - All // HIGHLAND ST. (from CROSSMAN to WINTHROP STS.) - EVEN #s // HIGHLAND ST. (from WINTHROP to OAK STS.) - ODD #s
,,WESTVILLE,6-9,WINTHROP ST. #3,45,WINTHROP ST. (from FAIRVIEW AVE. to BILTMORE ST.) - ODD #s // PAR PLACE - All // DEXTER FARM RD. - All // MARSHA BLISS CIR. - All // BILTMORE ST. - All 
,,WESTVILLE,6-10,WINTHROP ST. #4,75,WINTHROP ST. (from WARNER BLVD. to HAROLD ST.) - EVEN #s // HARVARD ST. - All // PARKER TERR. - All // HAROLD ST. - All // S. WALKER ST. (from WINTHROP ST. to DIGHTON LINE) - EVEN #s
,,WESTVILLE,6-11,N. WALKER ST.,150,WINTHROP ST. (from BILTMORE to N. WALKER STS.) - ODD #s // N. WALKER ST. - All // ROCKY WOODS ST. (SECTION OFF N. WALKER ST.) - All // FALL BROOK ESTATES - All // GLEBE ST. - All // GLEBE CT. - All 
,,WESTVILLE,6-12,WINTHROP ST. #5,120,WINTHROP ST. (from N. WALKER ST. to RANGE AVE.) - ODD #s // WINTHROP LN. - All // RANGE AVE. - All // OVERLOOK DR. - All // PINERIDGE CIR. - All // ROCKY WOODS ST. (from RANGE AVE. to ANDREA LN.) - All // ALEXANDRA DR. - All // ANDREA LN. - All 
,,WESTVILLE,6-13,WINTHROP ST. #6,100,WINTHROP ST. (from RANGE AVE. to INDIAN RIDGE) - ODD #s // WINTHROP HEIGHTS DR. - All // ALANITA DR. - All // CRAVEN CT. - All // INDIAN RIDGE CONDOMINIUMS - All // WINTHROP ST. (from BURT to HAROLD STS.) – EVEN #s
,,WESTVILLE,6-14,BURT ST.  #1,60,BURT ST. (from WINTHROP to ROCKY WOODS STS.) - All // GULLIVER ST. - All // ROCKY WOODS ST. (from BURT ST. to ANDREA LN.) - All 
,,WESTVILLE,6-15,BURT ST. #2,95,BURT ST. (from ROCKY WOODS ST. TO GREENWOOD CIR.) - All // LANEWAY ST. - All // CHRIS DR. - All // SARA DR. - All // GREENWOOD CIR. - All // LEHNER DR. - All 
,,WESTVILLE,6-16,BURT ST. #3,100,BURT ST. (from GREENWOOD CIR. to GLEBE ST.) - All // KIMBERLY RD. - All // BRIAR RD. - All // DEERHILL RD. - All // CAROLINE DR. - All // KRISTIN DR. - All // ANNE DR. - All 
,,WESTVILLE,6-17,BURT ST. #4,125,BURT ST. (from GLEBE to TREMONT STS.) - All // GLEBE ST. (SECTIONS OFF BURT ST.) - All // JAMES LUTHER DR. - All // FOREST HILL DR. - All // MORGAN DR. - ALL QUARTER CT. - ALL
,,WESTVILLE,6-18,S. WALKER ST.,110,S. WALKER ST.(WINTHROP ST. TO DIGHTON LINE)-ODD #s // NICHOLS DR. - All // WAGON WHEEL RD. - All // ARBOR WAY - ALL VILLAGE CIR. - All // FIELDSTONE DR. - All 
,,WESTVILLE,6-19,HIGHLAND ST.,140,HIGHLAND ST. (from CROSSMAN to FISHER STS.) - All // COURTLAND PL. - All // FISHER ST. - All // THREE MILE RIVER LN. - All // QUEQUECHAN RD. - All // MACINTOSH LN. - All 
,,WESTVILLE,6-20,DIGHTON AVE.,160,DIGHTON AVE. - All // CIERA CIR. - All // BAKER RD. (WEST) - All // SILVERSMITH WAY - All // JEANINE CIR. - All // CHRISTINE LN. - All // VICTORIA CIR. - All // JERRY WAY - All 

